{
  "$schema": "https://json-schema.org/draft/2020-12/schema",
  "title": "Question Bank v1 — proposed",
  "type": "object",
  "additionalProperties": false,
  "properties": {
    "schemaVersion": {
      "const": 1
    },
    "topic": {
      "type": "string",
      "minLength": 1
    },
    "groups": {
      "type": "array",
      "items": {
        "type": "object",
        "additionalProperties": false,
        "properties": {
          "id": {
            "type": "string",
            "minLength": 1
          },
          "title": {
            "type": "string",
            "minLength": 1
          },
          "material": {
            "type": "array",
            "items": {
              "oneOf": [
                {
                  "type": "object",
                  "additionalProperties": false,
                  "properties": {
                    "type": {
                      "const": "text"
                    },
                    "text": {
                      "type": "string",
                      "minLength": 1
                    }
                  },
                  "required": [
                    "type",
                    "text"
                  ]
                },
                {
                  "type": "object",
                  "additionalProperties": false,
                  "properties": {
                    "type": {
                      "const": "table"
                    },
                    "headers": {
                      "type": "array",
                      "items": {
                        "type": "string",
                        "minLength": 1
                      },
                      "minItems": 1
                    },
                    "rows": {
                      "type": "array",
                      "items": {
                        "type": "array",
                        "items": {
                          "type": "string",
                          "minLength": 1
                        },
                        "minItems": 1
                      },
                      "minItems": 1
                    }
                  },
                  "required": [
                    "type",
                    "headers",
                    "rows"
                  ]
                }
              ]
            },
            "minItems": 1
          },
          "questionIds": {
            "type": "array",
            "items": {
              "type": "string",
              "minLength": 1
            },
            "minItems": 2,
            "uniqueItems": true
          }
        },
        "required": [
          "id",
          "title",
          "material",
          "questionIds"
        ]
      }
    },
    "questions": {
      "type": "array",
      "items": {
        "$ref": "#/$defs/question"
      },
      "minItems": 1
    }
  },
  "required": [
    "schemaVersion",
    "topic",
    "groups",
    "questions"
  ],
  "$defs": {
    "question": {
      "type": "object",
      "additionalProperties": false,
      "properties": {
        "id": {
          "type": "string",
          "pattern": "^[a-z][a-z0-9-]*$"
        },
        "type": {
          "enum": [
            "single-choice",
            "multiple-choice",
            "true-false"
          ]
        },
        "question": {
          "type": "string",
          "minLength": 1
        },
        "material": {
          "type": "array",
          "items": {
            "oneOf": [
              {
                "type": "object",
                "additionalProperties": false,
                "properties": {
                  "type": {
                    "const": "text"
                  },
                  "text": {
                    "type": "string",
                    "minLength": 1
                  }
                },
                "required": [
                  "type",
                  "text"
                ]
              },
              {
                "type": "object",
                "additionalProperties": false,
                "properties": {
                  "type": {
                    "const": "table"
                  },
                  "headers": {
                    "type": "array",
                    "items": {
                      "type": "string",
                      "minLength": 1
                    },
                    "minItems": 1
                  },
                  "rows": {
                    "type": "array",
                    "items": {
                      "type": "array",
                      "items": {
                        "type": "string",
                        "minLength": 1
                      },
                      "minItems": 1
                    },
                    "minItems": 1
                  }
                },
                "required": [
                  "type",
                  "headers",
                  "rows"
                ]
              }
            ]
          },
          "minItems": 1
        },
        "options": {
          "type": "array",
          "items": {
            "type": "object",
            "additionalProperties": false,
            "properties": {
              "id": {
                "type": "string",
                "minLength": 1
              },
              "text": {
                "type": "string",
                "minLength": 1
              }
            },
            "required": [
              "id",
              "text"
            ]
          },
          "minItems": 2
        },
        "answer": {
          "type": "array",
          "items": {
            "type": "string",
            "minLength": 1
          },
          "minItems": 1,
          "uniqueItems": true
        },
        "explanation": {
          "type": "string",
          "minLength": 1
        },
        "source": {
          "type": "object",
          "additionalProperties": false,
          "properties": {
            "file": {
              "type": "string",
              "minLength": 1
            },
            "number": {
              "type": "integer",
              "minimum": 1
            }
          },
          "required": [
            "file",
            "number"
          ]
        }
      },
      "required": [
        "id",
        "type",
        "question",
        "options",
        "answer",
        "explanation",
        "source"
      ],
      "allOf": [
        {
          "if": {
            "properties": {
              "type": {
                "enum": [
                  "single-choice",
                  "true-false"
                ]
              }
            }
          },
          "then": {
            "properties": {
              "answer": {
                "maxItems": 1
              }
            }
          }
        },
        {
          "if": {
            "properties": {
              "type": {
                "const": "multiple-choice"
              }
            }
          },
          "then": {
            "properties": {
              "answer": {
                "minItems": 2
              }
            }
          }
        },
        {
          "if": {
            "properties": {
              "type": {
                "const": "true-false"
              }
            }
          },
          "then": {
            "properties": {
              "options": {
                "minItems": 2,
                "maxItems": 2,
                "items": {
                  "type": "object",
                  "additionalProperties": false,
                  "properties": {
                    "id": {
                      "enum": [
                        "true",
                        "false"
                      ]
                    },
                    "text": {
                      "type": "string",
                      "minLength": 1
                    }
                  },
                  "required": [
                    "id",
                    "text"
                  ]
                }
              },
              "answer": {
                "items": {
                  "enum": [
                    "true",
                    "false"
                  ]
                }
              }
            }
          }
        }
      ]
    }
  }
}
